[{
        "acc_nr": "12334567891",
        "pesel": "00322802779",
        "date_of_birth": "12/28/2000",
        "e-mail": "bartek.janik@wp.pl"
    },
    {
        "acc_nr": "12334567891",
        "pesel": "00322802779",
        "date_of_birth": "12/28/2000",
        "e-mail": "bartek.jani@wp.pl"
    }
]